"Project Name","Status","Year Started","Year Completed","Platform","Grants and Awards","Press","Partners / Clients","Brief Project Overview","Video","Image Carousel","Longer description of our involvement and/or our process (1-3 paragraphs)","Papers published (Title, Publication, Year, Link)","Software, hardware, middleware, etc","Credits / Collaborators","Additional Contributors","Links","Category 1","Category 2","Total Fee","Category/Tags (OLD)","x","x","x","x","","","","","",""
"Frederic Church Ombra Exhibition","Completed","2019","2019","iOS","","","Sage and Coome Architects","""Frederic Church’s Ombra: Architecture in Conversation with Nature” showcases multimedia design concepts and installations, developed by leading architects and select artists.  As Guest Curator, Barry Bergdoll (of Columbia University and the Museum of Modern Art) invited a group of today’s most exploratory architects to respond to the transitional outdoor rooms at Olana that are so essential to the original 19th century design of Olana’s Main House. These architects were asked to examine assumptions about the relationship of architecture and landscape at Olana, as well as to explore the Main House’s transition to the surrounding natural environment, particularly in our time of climactic and environmental change. Agile Lens was brought on by Sage & Coome for the digital side of their contribution.","","https://drive.google.com/drive/folders/1OjfEgdqIzB-yEgrazHnzjPg4QD91P8gw?usp=drive_link","Built an iOS AR app for Sage and Coombe Architects to locate their design work (alongside that of artist Chris Doyle) as part of an architectural exhibition. Then provided training for how to build similar apps on their own for future projects.","","","","","","Architecture","","","","","","","","","","","","",""
"Statue of Liberty Museum","Completed","2017","2017","","","","","Toward the finalization of the design, optimized FXCollaborative’s Revit model to provide a photoreal VR tour of Liberty Island with their intervention in place. Careful attention was paid to landscaping features and ensuring the site looked as excellent as possible while maintaining a 90 FPS playback rate.","","https://drive.google.com/drive/folders/1Ia-ZixvnVhmsxXckFARUpbA1F8NHnDMX?usp=drive_link","","","","","","https://www.archdaily.com/917627/statue-of-liberty-museum-fxcollaborative","Architecture","","","","","","","","","","","","",""
"Ed Sullivan Theater","Completed","2017","2017","","","","Bravo Media","Agile Lens led development for Bravo Media of a GearVR and browser-based experience to determine optimal locations for architectural projection to achieve a seamless stained-glass effect. This was per Stephen Colbert’s request with a tight deadline before beginning his tenure on The Late Show, and the app needed to help save time in the planning process. The virtual projectors could be spawned, aimed with headpose, driven around the grid, and even have their throw distance adjusted as needed.","","https://drive.google.com/drive/folders/11PHmsCN3xnNDSr-8TOFLxDs3pDF9Fwkc?usp=drive_link","","","","","","","Architecture","","","","","","","","","","","","",""
"The Shed @ Hudson Yards","Completed","2016","2019","","","","","Agile Lens periodically created custom AR and VR experiences throughout the design process for Diller Scofidio + Renfro and Fisher Dachs Associates. Example use cases include parametric design options for maximizing seat count and a specialty equipment ‘clearance checker.’","","https://drive.google.com/drive/folders/1CAOtDRQhcxAxTCOzzTxAWE1is-8qONzl?usp=drive_link","","","","","","","Architecture","","","Architecture","","","","","","","","","",""
"Rice University Music and Performing Arts Center","Completed","2014","2020","","","","","","","https://drive.google.com/drive/folders/1hw65hoWh8yyRioe7jF6M2ZnMT2mymwqa?usp=drive_link","RUMPAC will house a three-tiered, 600-seat, European-style opera theatre with an orchestra pit for 70 musicians. “The opera house is a visual overture to prepare the audience to enter into the magical world conjured by the music, the story and the theatrical setting of the opera,” said architect Allan Greenberg. “It facilitates a journey into the mind of the composer, in which the human voice gives breath to a living fantasy.” Agile Lens has utilized virtual reality on this project from the earliest concept studies all the way through its now completed design (the project is currently under construction). This constantly updated VR model allowed the unique opportunity to evaluate the design at different stages, all while bearing in mind the human-scale experience of it. In concept design, the team utilized VR sketches and diagrammatic spatial models to determine the strongest overall direction in which to proceed. As the design developed, further options were built into the custom VR experience to determine ideal locations for aisles, seats, railings, catwalks, and lights. As the project neared completion, Agile Lens moved the project from the Unity3D visualization engine to Unreal Engine in order to better serve the photorealistic needs of the lighting and materials. In 2018 their work was a featured case study on Unreal Engine’s website.","","Unity, Unreal, Revit","","","","Architecture","","","Architecture","","","","","","","","","",""
"Intel Project Arena","Completed","2018","2018","","","","","","","https://drive.google.com/drive/folders/1c5IUF7eDCNnhxCBNtW5-rBkgoQdx4MY-?usp=drive_link","When Intel® set out to showcase the power of the Intel® Core™ i9 processor for a virtual reality project, they wanted to go big. As in, arena big. Not just with the structure itself, but with its most striking feature - the thousands of enthusiastic fans inside it. To show how its processors could handle such a computationally-intensive project, Intel commissioned Project Arena, a large virtual facility complete with a playing area, arena seating, lobby, and food court. The experience also includes thousands of virtual 3D fans who not only walk, sit, and move around like a real crowd, but also stand up and cheer at the click of a button. Beyond that, you can even pick a view you enjoy and with the click of a button, snap a beautiful V-Ray render. Agile Lens was brought on to lead the development of this one-of-a-kind VR experience. Working in collaboration with The Glimpse Group, Octopus, Supersymmetric, and HOK (who provided their 3D model of State Farm Arena), the project continuously evolved to accomodate innovative new possibilities, all the while keeping expectations in line with the capabilities of the target technology. The result is a powerful showcase of virtual reality at its most epic.","","Revit","The Glimpse Group, Octopus, Supersymmetric, HOK","","https://unrealengine.com/en-US/spotlights/intel-vr-arena-and-unreal-engine-making-a-fan-experience

https://www.intel.com/content/dam/develop/external/us/en/documents/intel-projectarena-solutionbrief-final.pdf​","","","","Immersive Marketing","","","","","","","","","",""
"Alive In Plasticland","Completed","2018","2019","High Fidelity VR","","","High Fidelity, Double Eye Productions, Cinema360","In partnership with High Fidelity, Agile Lens produced and performed some short-form improv shows and improv workshops on their social VR platform with 6 actors sharing 3 headsets. Shows were performed for virtual and in-person audiences.","","https://drive.google.com/drive/folders/1wDReOoWjmJ3fETqoAnQN6uonkCaeGCKI?usp=drive_link","In a research and development initiative that fused digital and physical environments, the project, Alive in Plasticland, investigated advancements in the realm of live entertainment through virtual reality. A team of seven professional improvisers from New York City showcased short-form improvisational theater simultaneously to an online virtual audience and a live audience. This dual-audience format was facilitated using three HTC Vive headsets and High Fidelity’s social VR platform, which allowed for innovative use of virtual avatars and a seamless integration of virtual and real-world elements. The setup included live broadcast audio and a virtual camera system that projected the virtual theater experience into the physical theater, and vice versa, enriching the interactive experience for all attendees. Additionally, the project team conducted three improvisational workshops within the same VR platform and environment.","D. Gochfeld, K. Benzing, K. Laibson and A. Coulombe, ""Avatar Selection for Live Performance in Virtual Reality: A Case Study,"" 2019 IEEE Games, Entertainment, Media Conference (GEM), New Haven, CT, USA, 2019, pp. 1-5, doi: 10.1109/GEM.2019.8811548","","Co-directed by Kiira Benzing and Kevin Laibson
Produced by Alex Coulombe and David Gochfeld
Cast: Keisha Zollar, Sarah Nowak, Ray Cordova, Jake Keefe, Tracy Mull, Josh Hurley, Katie Hartman
Emcee: Kevin Laibson
Associate Producer: Michelle Francesca Thomas​","Sponsored in part by HTC Vive, Shows & Workshops hosted in physical space by VRBar & Kishore Doddi. Video documentation by Adrian Vasquez de Velasco.","https://medium.com/alive-in-plasticland/virtual-theatre-in-high-fidelity-6702fd2f1171","Entertainment","Production/Performance Consultation (Billable)","","Performance","","","","","","","","","",""
"Loveseat","Completed","2019","2019","","Selection, Venice International Film Festival 2019 ","","","Two lonely, ordinary people are drawn into a reality show competition to win the love of a Perfect Partner (who looks an awful lot like an empty chair). Part-story, part-interaction between virtual and real worlds; the performers intersect realities in this comedy. Performed simultaneously to virtual and real world audiences.","","https://drive.google.com/drive/folders/1Y1lcVVO_Cein2MUCyWdn3H1-Jnw3dPzb?usp=drive_link","","","","Produced by Double Eye Studios
Written by Mac Rogers
Directed by Kiira Benzing
Cinematography by Adrian Vasquez de Velasco
Design Lead, Alex Coulombe & Agile Lens
Featuring: Jenn Harris, Jonathan David Martin, Sam Kebede
Costume Design: Heather Carey
Sound: Chapter Four
Viz: Nice Shoes
Composers: Lucas Lechowsi, Karim Douaidy
Technical Directors: David Gochfeld, Mark Sternberg, Daniel Sabio, Chris Toppino","","https://www.imdb.com/title/tt10857192/","Production/Performance Consultation (Billable)","Entertainment","","Performance","","","","","","","","","",""
"That Kind of Guy","Completed","2019","2019","Magic Leap","","Kent Bye's Podcast Voices of VR Episode #806","Theatre Communications Group National Conference","A tabletop theater volcap/mocap study for the TCG conference about the kind of guy who, when he walks into a room, everybody notices him.","https://youtu.be/zaiMO-6qD2Y","https://drive.google.com/drive/folders/14_wzfJ3TEvjwOmldeqz5Ss9_xz5CUFdu?usp=drive_link","This tabletop performance experiment was created for the 2019 Theatre Communications Group National Conference in order to demonstrate to theatre-makers some pros and cons of volumetric capture versus motion capture.

An example: volcap looks more like that actual performer but is more 'baked,' while mocap has less realism but also allows for more post-production and real-time interactivity, such as always having a character look at you.

Additionally, we wanted to combat the perception that producing such an experience is prohibitively expensive, as we created this on minimal budget using  consumer-level technology.","","Depthkit, Unity, Microsoft Azure Kinect, Vive Trackers","Written & Performed by Josephine Simple","","","Performance Research (Non-billable)","Entertainment","","Performance","","","","","","","","","",""
"Ghosted","Completed","2019","2019","Magic Leap","Winner, Most Innovative Immersive Experience Award, NBFF; Winner, Audience Live Poll Prize, NYCMedia Lab Expo; Nominee, Best Art or Film, AWE Auggie Awards; Finalist, Cannes XR Development Showcase; Recipient of the Wassaic Haunted Mill Residency (2022)","","North Bend Film Festival","Ghosted is an interactive augmented reality performance piece, featuring volumetrically captured actors appearing across a table from the user in a simulated dating simulator -- for ghosts!","","https://drive.google.com/drive/folders/1Yfae-GpNHrBvG877a1_wfhDQv2qaAIR1?usp=drive_link","An open commission by the North Bend Film Festival, Ghosted was designed from the start to use the limitations of the Magic Leap One headset and low-budget volumetric capture from one Azure Kinect by making the subjects of the piece ghosts who remain seated across the table from you. The limited mobility is organic to the setting (a speed-dating scenario) and also keeps the AR objects well within the headset's field of view. It also allowed us to use single-angle volumetric shots, as the user would not be able to see the back half of the subjects anyway. 
We brought in collaborating artists from the NYC comedy and theater scene, compiled the scripts over the course of a month, and then shot each of the 17 vignettes over the course of a week. Those assets were assembled in to a functional app within another 6 weeks.","","Unreal Engine, Depthkit, Azure Kinect Camera, Adobe Premiere Pro","Lead Developer - Alex Coulombe

Head Writer, Producer - Allyson Morgan

Director, Producer - Kevin Laibson

On-set Consultant - David Gochfeld

AMANDA - Written & Performed by Marina Tempelsman • CRAGE - Written & Performed by J.W. Crump • MARGARET - Written & Performed by Robin Virginie • HAZEL - Written & Performed by Sarah Nowak • CORY - Written by Emily Chaddick Weiss; Performed by Steven Boyer • GUS PIZZA - Written & Performed by Mark Vigeant • DWIGHT - Written by Caroline V. McGraw; Performed by Curran Connor • TAMSI - Written & Performed by Tamsi New • ALEISTER - Written and Voice performed by Lucas Hazlett; MoCap performance by Kevin Laibson • LUCY - Written & Performed by Lucy Cottrell • DONALD - Written by Niccolo Aeed; Performed by Donald Chang • EDIE - Written by Joshua Conkel; Performed by Jill Frutkin • GORDON - Written & Performed by Jake Keefe • ALEX - Written & Performed by Alex Song • GARY - Written & Performed by Nick Carrillo • LLANA - Written & Performed by Amy Staats • SHE - Written by Gregory S. Moss; Performed by David Mitsch • GHOST HOST - Written & Performed by Allyson Morgan •
 

Special thanks to Magic Leap, Scatter, and the team at the North Bend Film Festival for their support.","","","Performance Research (Non-billable)","Entertainment","","Performance","","","","","","","","","",""
"Jettison / On Board XR","Completed","2020","2021","Mozilla Hubs","Nominee, Producers Guild of America Innovation Award","","Brendan Bradley","In July 2020, a group of theater and XR creators joined forces to experiment with live theater in open source, browser-based VR (on Mozilla Hubs). Two months later they presented the one act play, Jettison, for live virtual audiences at The Here Festival.","","https://drive.google.com/drive/folders/1O9EJsSLivhRThcbggqxayQtMB1T5K8vq?usp=drive_link","For Jettison and its revival in the first On Board XR Festival, our producing team handled general management tasks for the production as well as heading up design, house management and stage management, in both systems and operation.  ","Coulombe, A., Gochfeld, D., Bradley, B., Laibson, K., Long, R., Miletitch, R.  ""Virtual Reality Live theatre on No Budget: A Model for Independent Theatrical Productions using Open-Source Social VR""  SIGGRAPH '21: ACM SIGGRAPH 2021 Educators Forum Aug 2021 Article No.: 2
https://doi.org/10.1145/3450549.3464413","Mozilla Hubs, OBS, OBS Ninja","By Brendan A. Bradley Directed by David Gochfeld Produced by Alex Coulombe, Kevin Laibson, David Gochfeld, Brendan A. Bradley Virtual Space Integration by Roman Miletitch Featuring: Brendan A. Bradley Nick Carrillo Nican Robinson Digital Puppetry by Ashley Clements Performed in Mozilla Hubs at The Brendan A. Bradley Future Stages Theater","","https://www.brendanabradley.com/futurestages/2020/11/30/live-theater-in-virtual-reality https://www.broadwayworld.com/off-off-broadway/article/JETTISON-a-New-Play-Produced-Rehearsed-and-Performed-in-Virtual-Reality-Closes-Out-Here-Online-Oasis-Weekend-20201001","Performance Research (Non-billable)","Entertainment","","Performance","","","","","","","","","",""
"A Christmas Carol VR","Completed","2021","","Unreal Engine","","","Originally produced in collaboration with Actors Theatre of Louisville","A Christmas Carol VR is a live, real-time immersive adaptation of Dickens' classic, blending immersive theater with cutting-edge technology. Live actors with facial and motion capture perform on the streets of a virtual Victorian London.","https://youtu.be/kLMbr8OJGe4","https://drive.google.com/drive/folders/15WRhLmP872PGPjQI8mtQWDvl140nQ4L7?usp=drive_link","Initially, we partnered with Actors Theater of Louisville for their annual in-person production of A Christmas Carol in 2021. Their new artistic director, Robert Barry Fleming, had seen our presentation of That Kind of Guy at the TCG Conference earlier in the year, and wanted to engage us to help create and integrate digital characters and environments in to their live show. In years since, ATL gave us their blessing to remount it annually however we'd like, and it has become a yearly R&D tradition for us. Each year we set out to try out new production systems, from distribution and ticket management to motion capture solutions and actor/audience interaction methods.","","","Ari Tarr as Dickens, Scrooge, Others Debbie Deer as the Ghosts Based on the novella ""A Christmas Carol"" by Charles Dickens Adapted and Directed for VR by: David Gochfeld Based on the adaptation by: Robert Barry Fleming Stage Manager: Stef Buckner Associate Stage Manager: Josi Morgan Lead Developer: Yu-Jun Yeh Developer Team: Yu-Jun Yeh Dante Cameron Josi Morgan Marshall Nowak Alex Coulombe XR Performance Consultant: Ari Tarr QA: Michael Burgess Environmental Design: Delta Ark Dante Cameron Josi Morgan Sarah Reed Sound Design: Josi Morgan Software Engineer: Eytan Manor Producers: Alex Coulombe Kevin Laibson __ Livestream Cinematographer: Jackie Roman Camera Operator and Streamer: Carlos Austin Camera Operator: John Harvey __ Special thanks to Alex from outofthebox-plugins.com for UE Plugin upgrade assistance FGI X Miami 2023 premiere with support from Z by HP Meta Quest Pros and Puget Workstation support from Impossible Ventures __ Additional Credits First produced in 2021 in association with Actors Theatre of Louisville Written and Directed by: Robert Barry Fleming XR Producer: Zachary Meicher-Buzzi Digital Performance Specialist: Rob Lester Technical Artists: Alden Pedula Adam Vosburgh Motion Capture Artists: Kavin Moore and Brittany “BeeBee” Patillo Scenic Design: Katelin Ashcraft Costume Designer: Anna Jenny Sound Design: Paul Doyle","","","Performance Research (Non-billable)","Entertainment","","Performance","","","","","","","","","",""
"The Orchard","Completed","2022","2022","Baryshnikov Arts Center Off Broadway / Virtual Platform TK","","Playbill.com, Boston Globe, Marina Abramovic's Cultural Highlights for The Globe UK","Arlekin Players & zero-G Virtual Theater Lab / Groundswell Theatre, Inc.","Agile Lens created and implemented the virtual side of this groundbreaking hybrid performance starring Mikhael Baryshnikov and Jessica Hecht in an adaptation of Anton Chekhov's The Cherry Orchard","https://youtu.be/vAE3DQ4rnHw","https://drive.google.com/drive/folders/1NgSkATlohCyvZ5b45HsIqZF-_cTBtlLF?usp=drive_link","","","","Produced by: Arlekin Players Theatre & Zero-Gravity (zero-G) Virtual Theater Lab, Groundswell Theatricals Inc., Cherry Orchard Festival
Cast: Jessica Hecht, Mikhail Baryshnikov, Juliet Brett, Darya Denisova, Seth Gore, Elise Kibler, Nael Nacer, Jeff Hayenga, Gene Ravvin","","https://www.theorchardoffbroadway.com/","Production/Performance Consultation (Billable)","Entertainment","","Performance","","","","","","","","","",""
"Song of the Ambassadors","Completed","2022","2022","Alice Tully Hall @ Lincoln Center","","The New York Times - Music, Science and Healing Intersect in an A.I. Opera
BOMB Magazine - Making the Invisible Visible: K Allado-McDowell, Derrick Skye, and Refik Anadol in Conversation
The Wie Suite - Lincoln Center's Chief Artistic Officer, Shanta Thake, Is Sharing Her Brain (Waves) With the World","","Agile Lens provided previz for this experimental piece at Alice Tully Hall featured lighting design by Refik Anadol, now doing the Las Vegas Sphere.","https://youtu.be/gY5GA_L9NXM","https://drive.google.com/drive/folders/10KELt584LwdpJz1yvn8aGxbH6m3yhoBd?usp=drive_link","","","Unreal Engine","Composed by Derrick Skye
Libretto by K Allado-McDowell (with GPT-3)
Stage Direction by Mary Birnbaum
Projections by Refik Anadol
Set Designs by Marcos Lutyens
Costume Designs by Oana Botez
Sound Design by Ian Smith
Neuroscience Research and Studies by Ying Wu and Alexander K. Khalil (UCSD)
Conceived by K Allado-McDowell
Produced by KAM Studio in collaboration with Ben Newman and Lincoln Center","","https://www.songoftheambassadors.com/","Production/Performance Consultation (Billable)","Entertainment","","Performance. Pre-viz","","","","","","","","","",""
"Waldorf Astoria Miami","Completed","2022","2022","","","","","","","https://drive.google.com/drive/folders/18J7IT_9nfCpvq9G_Uv4zs_LuBDP-vrqt?usp=drive_link","","","","","","","Immersive Marketing/Retail","","","Immersive Marketing","","","","","","","","","",""
"Four Seasons Lake Austin","Completed","2023","","","","https://www.papercitymag.com/real-estate/four-seasons-private-residences-lake-austin-creates-2-million-holodeck-real-estate-amenities/#465572","","This 5,300 square foot space allows guests to virtually experience what $300 million worth of amenities and shared facilities will feel like at Four Seasons Private Residences. Guests can walk freely and wirelessly around an 82 x 65-foot space and feel like they are walking around a finished residence, the lake clubhouse, indoor sports club, private restaurant, and theater. The experience ends with guests walking into a virtual 96-seat theater and then sitting in four real theater seats.","","https://drive.google.com/drive/folders/1IIojZy7fuWkRKXhcnaw9nd_tYYW81B13?usp=drive_link","Agile Lens worked in the development and production phases of this project; we optimized the levels that Pureblink built from DBox's renders, and assembled the software experience to navigate between those levels. We also led the setup and implementation of the holodeck itself, working with the client to develop the entire guest experience from entering the holodeck through the virtual tour. We staffed and managed the first 6 months of operation and managed the operations handoff to a local team. ","","Unreal Engine, Optitrack system, Motive, Antilatency","","","https://youtu.be/6la2yieiCG0?si=fU2Z1CZMOKTgX-g4","Real Estate","","","Real Estate","","","","","","","","","",""
"Dell Cybersecurity VR Challenge","Completed","2023","2023","Dell Technologies World in Las Vegas","","","Fair Worlds, Dell","We were excited for Fair Worlds to bring us on to this project for Dell Technologies, which through a central narrative of a cybersecurity booth that's been hacked, walked users through the central tenets of Dell's Cybersecurity offerings.","https://vimeo.com/874205089","https://drive.google.com/drive/folders/13_LMtJU6ZCYVxRO40Aot9bJpR8arVaku?usp=drive_link","For this project, we helped with the motion capture and metahuman pipelines, including directing the actors in mocap sessions and getting the mocap software integrated to their Unreal project.","","move.ai, Unreal Engine","","","https://www.fairworlds.com/blog/dell-cybersecurity-vr-challenge","Immersive Marketing/Retail","","","Immersive Marketing","","","","","","","","","",""
"Vodafone","Completed","2023","2023","","","","","Agile Lens developed an immersive VR car showroom experience with an AI car salesman powered by inworld.ai and vehicle customization, showcasing Vodafone's DAB platform for London Tech Week. ","","https://drive.google.com/drive/folders/1pu6zNl01lSQk6bP1mMT6nZ9i50Zkbzzr?usp=drive_link","","","","","","https://www.businesswire.com/news/home/20230719281018/en/Infinite-Reality-and-Vodafone-Digital-Asset-Broker-Join-Forces-to-Create-Extraordinary-Metaverse-Showroom-at-London-Tech-Week
https://www.theinfinitereality.com/news/infinite-reality-and-vodafone-showcase-ai-onboard-a-revolutionary-automotive-onboarding-service-at-mobile-world-congress-part-of-ongoing-strategic-partnership
https://www.youtube.com/watch?v=ZuqmYgvZV2g","Immersive Marketing/Retail","","","Immersive Marketing","","","","","","","","","",""
"La Pasión XR","Completed","2024","","","","","Gateway Chamber Orchestra","“La Pasión XR"" takes guests on an ephemeral, audio-reactive journey through the Gateway Chamber Orchestra’s performance of Osvaldo Golijov's La Pasion según San Marcos. Guests begin downstage in a point cloud scan of the concert hall. There is a soft hum from instruments and music stands dissolving in and out of existence, and guests are presented with a menu for selecting an experience mode, viewing controls and credits. They can freely navigate the theater in their VR headset using teleportation, smooth locomotion and snap rotation. Experience options include a volumetric highlight sequence of the concert and two full featured movements to explore, each with bonus 360 video content and more.","https://youtu.be/iqZQZzXkTRQ?si=m4Kazvj5isXsnsHg","https://drive.google.com/drive/folders/1n5BsaaTbCsXEz2IPwpgplywzbFntQTyN?usp=drive_link","","","","https://docs.google.com/document/d/1ArXL2V1sFqGfab-Lfm8YE_GhqnwXYgE9pSNs6zN1nZY/edit?usp=sharing","","","Entertainment","Production/Performance Consultation (Billable)","","Performance","","","","","","","","","",""
